{
  "schemaVersion": 1,
  "feature": "016-access-governance",
  "specificationPath": "specs/016-access-governance/spec.md",
  "normativeRevision": "aaaaaaaaaaaaaaaaaaaaaaaaaaaaaaaaaaaaaaaaaaaaaaaaaaaaaaaaaaaaaaaa",
  "decisions": {
    "product": {
      "assignedReviewer": "product@example.edu",
      "decision": "pending",
      "decidedRevision": null,
      "decidedAt": null,
      "rationale": ""
    },
    "testing": {
      "assignedReviewer": "testing@example.edu",
      "decision": "pending",
      "decidedRevision": null,
      "decidedAt": null,
      "rationale": ""
    },
    "development": {
      "assignedReviewer": "development@example.edu",
      "decision": "pending",
      "decidedRevision": null,
      "decidedAt": null,
      "rationale": ""
    }
  },
  "exceptions": []
}
